{
  "input_folder": "C:\\inetpub\\wwwroot\\media\\input",
  "output_folder": "C:\\inetpub\\wwwroot\\media\\output",
  "ffmpeg_params": {
    "video_encoder": "h264_nvenc",
    "preset": null,
    "tune": null,
    "fps": 30,
    "include_audio": true,
    "bitrates": {
      "1080p": "8000k",
      "720p": "4500k",
      "480p": "2500k",
      "360p": "1000k"
    },
    "audio_bitrates": ["128k", "96k", "64k", "48k"]
  },
  "max_parallel_jobs": 6,
  "auto_rename_files": true,
  "auto_organize_folders": true,
  "file_rename_pattern": "(\\d+-\\d+)(?:[_-].*?)?\\.mp4$",
  "file_validation_pattern": "^\\d+-\\d+\\.mp4$",
  "folder_organization_pattern": "^(\\d+)-\\d+",
  "last_used_profile": "fast_encoding",
  "saved_at": "2023-07-15T13:00:00.000000"
}
