{
  "input_folder": "C:\\inetpub\\wwwroot\\media\\input",
  "output_folder": "C:\\inetpub\\wwwroot\\media\\output",
  "ffmpeg_params": {
    "video_encoder": "libx265",
    "preset": "medium",
    "tune": "film",
    "fps": 60,
    "include_audio": true,
    "bitrates": {
      "1080p": "15000k",
      "720p": "8500k",
      "480p": "5000k",
      "360p": "2500k"
    },
    "audio_bitrates": ["256k", "192k", "128k", "96k"]
  },
  "max_parallel_jobs": 2,
  "auto_rename_files": true,
  "auto_organize_folders": true,
  "file_rename_pattern": ".*?(\\d+-\\d+).*?\\.mp4$",
  "file_validation_pattern": "^\\d+-\\d+\\.mp4$",
  "folder_organization_pattern": "^(\\d+)-\\d+",
  "last_used_profile": "high_quality",
  "saved_at": "2023-07-15T12:30:00.000000"
}
