{
  "input_folder": "C:\\inetpub\\wwwroot\\media\\input",
  "output_folder": "C:\\inetpub\\wwwroot\\media\\output",
  "ffmpeg_params": {
    "video_encoder": "libx265",
    "preset": "ultrafast",
    "tune": "zerolatency",
    "fps": 60,
    "include_audio": true,
    "bitrates": {
      "1080p": "11000k",
      "720p": "6500k",
      "480p": "4000k",
      "360p": "1500k"
    },
    "audio_bitrates": ["192k", "128k", "96k", "64k"]
  },
  "max_parallel_jobs": 4,
  "auto_rename_files": true,
  "auto_organize_folders": true,
  "file_rename_pattern": "(\\d+-\\d+)(?:[_-].*?)?\\.mp4$",
  "file_validation_pattern": "^\\d+-\\d+\\.mp4$",
  "folder_organization_pattern": "^(\\d+)-\\d+",
  "last_used_profile": "default",
  "saved_at": "2023-07-15T12:00:00.000000"
}
